{
  "schema_version": 1,
  "period": "2026-10",
  "snapshot_date": "2026-10-01",
  "fetched_at": "2026-10-01T13:08:45+00:00",
  "comparison": {
    "previous_snapshot_date": "2026-09-26",
    "metrics_change": {
      "raw": {
        "works": -1,
        "citations": 2,
        "h_index": 0,
        "i10_index": 0
      },
      "curated": {
        "works": 0,
        "citations": 0,
        "h_index": 0,
        "i10_index": 0
      }
    }
  },
  "profile": {
    "id": "https://openalex.org/A5060369592",
    "orcid": "https://orcid.org/0000-0002-9576-9239",
    "display_name": "Joe M. Roberts"
  },
  "metrics": {
    "raw": {
      "works": 45,
      "citations": 399,
      "h_index": 9,
      "i10_index": 9
    },
    "curated": {
      "works": 45,
      "citations": 399,
      "h_index": 9,
      "i10_index": 9
    }
  },
  "publications": {
    "all": [
      {
        "date": "2026-10-01",
        "work_id": "W3007560514",
        "doi": "https://doi.org/10.1111/aab.12587",
        "title": "Vertical farming systems bring new considerations for pest and disease management",
        "publication_year": 2020,
        "type": "article",
        "source": "Annals of Applied Biology",
        "citations": 81,
        "included_in_curated": true
      },
      {
        "date": "2026-10-01",
        "work_id": "W2802825342",
        "doi": "https://doi.org/10.1016/j.cropro.2018.04.011",
        "title": "Terpene based biopesticides as potential alternatives to synthetic insecticides for control of aphid pests on protected ornamentals",
        "publication_year": 2018,
        "type": "article",
        "source": "Crop Protection",
        "citations": 76,
        "included_in_curated": true
      },
      {
        "date": "2026-10-01",
        "work_id": "W4385308756",
        "doi": "https://doi.org/10.1111/eea.13351",
        "title": "Scents and sensibility: Best practice in insect olfactometer bioassays",
        "publication_year": 2023,
        "type": "article",
        "source": "Entomologia Experimentalis et Applicata",
        "citations": 49,
        "included_in_curated": true
      },
      {
        "date": "2026-10-01",
        "work_id": "W3016131663",
        "doi": "https://doi.org/10.1007/s10886-020-01172-8",
        "title": "Behavioural and Electrophysiological Responses of Female Anopheles gambiae Mosquitoes to Volatiles from a Mango Bait",
        "publication_year": 2020,
        "type": "article",
        "source": "Journal of Chemical Ecology",
        "citations": 43,
        "included_in_curated": true
      },
      {
        "date": "2026-10-01",
        "work_id": "W3204869631",
        "doi": "https://doi.org/10.3389/fpls.2021.711896",
        "title": "Effects of cis-Jasmone Treatment of Brassicas on Interactions With Myzus persicae Aphids and Their Parasitoid Diaeretiella rapae",
        "publication_year": 2021,
        "type": "article",
        "source": "Frontiers in Plant Science",
        "citations": 38,
        "included_in_curated": true
      },
      {
        "date": "2026-10-01",
        "work_id": "W2982285174",
        "doi": "https://doi.org/10.1007/s10886-019-01108-x",
        "title": "Electrophysiological and Behavioral Responses of Adult Vine Weevil, Otiorhynchus sulcatus (Coleoptera: Curculionidae), to Host Plant Odors",
        "publication_year": 2019,
        "type": "article",
        "source": "Journal of Chemical Ecology",
        "citations": 17,
        "included_in_curated": true
      },
      {
        "date": "2026-10-01",
        "work_id": "W4379209074",
        "doi": "https://doi.org/10.1111/aab.12846",
        "title": "Exploiting volatile organic compounds in crop protection: A systematic review of 1‐octen‐3‐ol and 3‐octanone",
        "publication_year": 2023,
        "type": "review",
        "source": "Annals of Applied Biology",
        "citations": 15,
        "included_in_curated": true
      },
      {
        "date": "2026-10-01",
        "work_id": "W4220832207",
        "doi": "https://doi.org/10.1146/annurev-ento-071221-060822",
        "title": "Vine Weevil,Otiorhynchus sulcatus(Coleoptera: Curculionidae), Management: Current State and Future Perspectives",
        "publication_year": 2022,
        "type": "review",
        "source": "Annual Review of Entomology",
        "citations": 14,
        "included_in_curated": true
      },
      {
        "date": "2026-10-01",
        "work_id": "W2956372050",
        "doi": "https://doi.org/10.1002/ps.5545",
        "title": "Catch me if you can: the influence of refuge / trap design, previous feeding experience, and semiochemical lures on vine weevil (Coleoptera: Curculionidae) monitoring success",
        "publication_year": 2019,
        "type": "article",
        "source": "Pest Management Science",
        "citations": 11,
        "included_in_curated": true
      },
      {
        "date": "2026-10-01",
        "work_id": "W4205464934",
        "doi": "https://doi.org/10.3390/insects13010080",
        "title": "Optimising Vine Weevil, Otiorhynchus sulcatus F. (Coleoptera: Curculionidae), Monitoring Tool Design",
        "publication_year": 2022,
        "type": "article",
        "source": "Insects",
        "citations": 9,
        "included_in_curated": true
      },
      {
        "date": "2026-10-01",
        "work_id": "W4390906255",
        "doi": "https://doi.org/10.1111/1744-7917.13316",
        "title": "The clip cage conundrum: Assessing the interplay of confinement method and aphid genotype in fitness studies",
        "publication_year": 2024,
        "type": "article",
        "source": "Insect Science",
        "citations": 8,
        "included_in_curated": true
      },
      {
        "date": "2026-10-01",
        "work_id": "W4280538107",
        "doi": "https://doi.org/10.1111/aab.12776",
        "title": "Evaluation of resistance to black bean aphid (Aphis fabae) in selected varieties and mutant genotypes of common bean (Phaseolus vulgaris)",
        "publication_year": 2022,
        "type": "article",
        "source": "Annals of Applied Biology",
        "citations": 6,
        "included_in_curated": true
      },
      {
        "date": "2026-10-01",
        "work_id": "W4281839811",
        "doi": "https://doi.org/10.1016/j.cropro.2022.106030",
        "title": "Induced mutagenesis: An underutilised component in the integrated management of aphid pests in sub-Saharan Africa",
        "publication_year": 2022,
        "type": "article",
        "source": "Crop Protection",
        "citations": 5,
        "included_in_curated": true
      },
      {
        "date": "2026-10-01",
        "work_id": "W4384277394",
        "doi": "https://doi.org/10.1002/ps.7665",
        "title": "Decoding attraction: Improving vine weevil monitoring by exploiting key sensory cues",
        "publication_year": 2023,
        "type": "article",
        "source": "Pest Management Science",
        "citations": 4,
        "included_in_curated": true
      },
      {
        "date": "2026-10-01",
        "work_id": "W4401630186",
        "doi": "https://doi.org/10.1016/j.cropro.2024.106904",
        "title": "Temperature and time of season are the predominant drivers of cabbage stem flea beetle, Psylliodes chrysocephala, arrival at oilseed rape crops",
        "publication_year": 2024,
        "type": "article",
        "source": "Crop Protection",
        "citations": 4,
        "included_in_curated": true
      },
      {
        "date": "2026-10-01",
        "work_id": "W4411041366",
        "doi": "https://doi.org/10.1007/s12011-025-04668-0",
        "title": "A Re-evaluation of the Optimal Liver Copper Concentrations for Health, Performance and Fertility of Replacement Holstein–Friesian Heifers",
        "publication_year": 2025,
        "type": "article",
        "source": "Biological Trace Element Research",
        "citations": 2,
        "included_in_curated": true
      },
      {
        "date": "2026-10-01",
        "work_id": "W4410038418",
        "doi": "https://doi.org/10.3390/insects16050477",
        "title": "Effects of Confinement and Wheat Variety on the Performance of Two Aphid Species",
        "publication_year": 2025,
        "type": "article",
        "source": "Insects",
        "citations": 2,
        "included_in_curated": true
      },
      {
        "date": "2026-10-01",
        "work_id": "W4294891858",
        "doi": "https://doi.org/10.1007/s11829-022-09919-8",
        "title": "Gamma irradiation as a tool to produce cowpea (Vigna unguiculate (L.) Walp.) genotypes resistant to aphid pests",
        "publication_year": 2022,
        "type": "article",
        "source": "Arthropod-Plant Interactions",
        "citations": 2,
        "included_in_curated": true
      },
      {
        "date": "2026-10-01",
        "work_id": "W4412929723",
        "doi": "https://doi.org/10.1016/j.atech.2025.101244",
        "title": "Novel nocturnal insect pest monitoring for sustainable crop protection using ensemble augmented deep learning classification",
        "publication_year": 2025,
        "type": "article",
        "source": "Smart Agricultural Technology",
        "citations": 2,
        "included_in_curated": true
      },
      {
        "date": "2026-10-01",
        "work_id": "W4402006542",
        "doi": "https://doi.org/10.1111/aab.12936",
        "title": "Special issue on entomology: A tribute to Prof. Simon R. Leather",
        "publication_year": 2024,
        "type": "editorial",
        "source": "Annals of Applied Biology",
        "citations": 2,
        "included_in_curated": true
      },
      {
        "date": "2026-10-01",
        "work_id": "W4401441452",
        "doi": "https://doi.org/10.1093/jee/toae175",
        "title": "‘The Garlic Gambit’: an alternative strategy for controlling vine weevil (Otiorhynchus sulcatus F.; Coleoptera: Curculionidae)",
        "publication_year": 2024,
        "type": "article",